Ontology ID,label,has curation status,alternative term,definition,definition source,example of usage,editor note,term editor,ontology term requester,term tracker item,logical type,parent class,material processing technique,detection technique,evaluant,analyte,device,output,input,input of,output of ,obejective,associated axioms
KSC_M:00000208,voltammetry,,,Extracellular electrophysiological method designed to measure currents when a continuous or variable differential of potential is applied. A small and linearly varying potential is applied between a microelectrode and the medium and the resulting current-potential curve (voltammogram) is recorded. The voltammogram is characteristic of the nature and concentration of electro-oxidizable or reducible materials close to the electrode surface. The cycle can be repetead for smaller or higher values of the applied voltage.,Mihail Bota,,,,,,,extracellular recording,,,,,,,,,,,
KSC_M:00000209,electroencephalography,,EEG,Electrophysiological method designed to measure the electrical activity of the brain at the level of the scalp.,Mihail Bota,,,,,,,extracellular recording,,,,,,,,,,,
KSC_M:00000210,electrocortigraphy,,ECoG,"Also known as intracranial EEG (iEEG), it is an invasive electrophysiological method designed to measure electrical activity at the level of the surface of cortex. The electrodes are placed directly onto the surface of the cerebral cortex.",Mihail Bota,,,,,,,extracellular recording,,,,,,,,,,,
KSC_M:00000211,simple random sampling,,,Sampling statistical method where all any member of the population is considered to have the same probability of selection. The selection of units is performed by using previously defined randomization procedures.,Mihail Bota,,,,,,,sampling method,,,,,,,,,,,
KSC_M:00000212,stratified random sampling,,,"Sampling statistical method where the units of the population are distributed over a number of non-overlaping ""strata' (the population is partitioned). The members of the population will have the values of the variable used for partitioning much closer one to the other than any unit from a different stratum. The sampling procedure is applied to each stratum. Two most commonly used criteria to divide a population in strata are the spatial location, and sizes of units.",Mihail Bota,,,,,,,sampling method,,,,,,,,,,,
KSC_M:00000213,systematic sampling,,,"Sampling method that is based on ordering of the population according to a sampling frame. The method usually employs the equi-probability approach where process of choosing the sample units is circular. First, an element is sampled at random, and from here each unit that is a specific distance from the previous (the skip) will be sampled. When this process gets to the end of the list, it restarts from the beginning. This method is applied when the population is logically homogeneous, and only when the population does not has any hidden pattern.",Mihail Bota,,,,,,,sampling method,,,,,,,,,,,
KSC_M:00000214,cluster sampling,,,Sampling method where the units are grouped together according to some criteria (clusters) are randomly sampled together and then all measured.,Mihail Bota,,,,,,,sampling method,,,,,,,,,,,
KSC_M:00000215,multistage sampling,,,"Sampling method where the units are hierarchically organized, and the units are randomly sampled at each level.",Mihail Bota,,,,,,,sampling method,,,,,,,,,,,
KSC_M:00000216,unequal probability sampling,,,Sampling method where the probability of a unit being sampled is a function of the characteristics of that unit.,Mihail Bota,,,,,,,sampling method,,,,,,,,,,,
KSC_M:00000217,adaptive cluster sampling,,,"Sampling method that is similar with cluster sampling, but the sizes (the number of units) of clusters and their number is unknown. In this method, a prior value C is established. If a given unit is higher or equal than C, then the units in its neighborhood are sampled.",Mihail Bota,,,,,,,sampling method,,,,,,,,,,,
KSC_M:00000218,line transect sampling,,,"Sampling method that is used for objects that are difficult to observe, or are rare. In this method, the observer moves along a line acroos the considered area looking at the right and left and noting each occurence of a given object. Line transects are walked, flown, or traversed, and the perpendicular distances to all detected objects of interest are recorded. Also known as distance sampling.",Mihail Bota,,,,,,,sampling method,,,,,,,,,,,
KSC_M:00000219,composite sampling,,,"Sampling methods designed for extracting subsamples from initial samples. First, the sampled units are grouped in composite units, and these will be further sampled.",Mihail Bota,,,,,,,sampling method,,,,,,,,,,,
KSC_M:00000220,clarity method,,,"Neuronal tissue vizualization method where the lipids from the membranes of neurons are eliminated through polymerization and electrophoresis. After this procedure is applied the tissue become translucid, and it can be investigated with sheet microscopy. The tissue preserves the initial form.",Mihail Bota,,,,,,,visualization method,,,,,,,,,,,
KSC_M:00000221,infusion,,,Class of methods of administration of substances into the body. Also known as route of administration (medicine).,Mihail Bota,,,,,,,method,,,,,,,,,,,
KSC_M:00000222,injection,,,"Class of infusion methods that use specific devices for administration of substances directly into the body. These devices (syringes with hollow needles, or pipettes) penetrate the skin of the body, and the substance is delivered mechanically, or using electric currents for micropipettes. Injections can be subdivided by the specific part of the body where the substance needs to be administrated, by the specific device of delivery, and by the mechanism of delivery.",Mihail Bota,,,,,,,infusion,,,,,,,,,,,
KSC_M:00000223,pressure injection,,,Injection method where a substance is delivered mechanically via a syringe or a pipette into the tissue of interest.,Mihail Bota,,,,,,,injection,,,,,,,,,,,
KSC_M:00000224,iontophoretic injection,,,Injection method where a substance is delivered in the tissue of interest by applying a small and temporary electrical current to the solution in the pipette.,Mihail Bota,,,,,,,injection,,,,,,,,,,,
KSC_M:00000225,nucleic acids and proteins measurement,,,Class of methods used for identification and measurement of nucleic acids and their products.,Mihail Bota,,,,,,,method,,,,,,,,,,,
KSC_M:00000226,Fast Blue tracing,,,Retrograde fluorescent tract tracing method.,Mihail Bota,,,,,,,retrograde fluorescent tracing,,,,,,,,,,,
KSC_M:00000227,Evans Blue tracing,,,Retrograde fluorescent tract tracing method.,Mihail Bota,,,,,,,retrograde fluorescent tracing,,,,,,,,,,,
KSC_M:00000228,Diamidino Yellow tracing,,,Retrograde fluorescent tract tracing method.,Mihail Bota,,,,,,,retrograde fluorescent tracing,,,,,,,,,,,
KSC_M:00000229,Fluorogold tracing,,,Retrograde fluorescent tract tracing method.,Mihail Bota,,,,,,,retrograde fluorescent tracing,,,,,,,,,,,