Ontology ID,label,has curation status,alternative term,definition,definition source,example of usage,editor note,term editor,ontology term requester,term tracker item,logical type,parent class,material processing technique,detection technique,evaluant,analyte,device,output,input,input of,output of ,obejective,associated axioms
KSC_M:00000124,retrograde tracing,,retrograde labeling,"Class of tract tracing methods that label the origins (cell bodies) of the neuroanatomical connections either by retrograde axonal transport, or by lesions.",Mihail Bota,,,,,,,tract tracing,,,,,,,,,,,
KSC_M:00000125,anterograde and retrograde tract tracing,,,Class of tract tracing methods that label both the axonal terminations and the cell bodies using both modes of axonal transport or lesions.,Mihail Bota,,,,,,,tract tracing,,,,,,,,,,,
KSC_M:00000126,tritiated amino acids tracing,,,"Anterograde tract tracing method using radioactive amino acids, which are delivered by pressure injection into the region of interest.",Mihail Bota,,,,,,,anterograde tracing,,,,,,,,,,,
KSC_M:00000127,horseradish peroxidase tracing,,HRP,"Both anterograde and retrograde tract tracing method that uses horseradish peroxidase as stain for axon terminals and neuronal cell bodies, respectively. However, HRP tracing is used mostly retrogradely. The HRP presence is detected using classical immunohistochemistry.",Mihail Bota,,,,,,,anterograde and retrograde tract tracing,,,,,,,,,,,
KSC_M:00000128,radioactive and non-radioactive HRP tracing,,,"Combination of the anterograde tritiated amino acids and of HRP tracing methods, used for visualization of axon colaterals. The radioactive HRP is enzymatically inactive, and the non-radioactive HRP is enzymatically active.",Mihail Bota,,,,,,,anterograde and retrograde tract tracing,,,,,,,,,,,
KSC_M:00000129,retrograde fluorescent tracing,,,"Class of tract tracing methods that use retrogradely transported fluorescent markers. Some of the most commonly used markers are Evans blue, Fast blue, Diamidino Yellow (DI), nuclear yellow, fluorogold (FG). These markers can be used as single tracers, in combinations (e.g., DI and FG), or with toxins-based tracers, and with anterograde tracers.",Mihail Bota,,,,,,,retrograde tracing,,,,,,,,,,,
KSC_M:00000130,wheat-germ agglutinin and horseradish peroxidase tracing,,WGA-HRP,"Combination of WGA and HRP as tract tracer, which can be used both anterogradely and retrogradely. ",Mihail Bota,,,,,,,anterograde and retrograde tract tracing,,,,,,,,,,,
KSC_M:00000131,cholera toxin tracing,,CTB,"Class of tracing methods that use bacterial toxins conjugated with HRP, fluorescein, or rhodamine beads. The most used bacterial toxis is non-toxic B fragment of cholera toxin (CTB). The detection is immunohistochemical, therefore this method is more sensitive than HRP. It can be used both anterogradely and retrogradely.",Mihail Bota,,,,,,,retrograde tracing,,,,,,,,,,,
KSC_M:00000132,micro- and nano-particles retrograde tracing,,,"Class of tracing methods that use small particles composed of a label-coated material, which can be employed alone, or conjugated with other tracers.",Mihail Bota,,,,,,,retrograde tracing,,,,,,,,,,,
KSC_M:00000133,rhodamine beads tracing,,,Retrograde tracing method that uses fluorescent rhodamine carrying latex beads,Mihail Bota,,,,,,,retrograde tracing,,,,,,,,,,,
KSC_M:00000134,gold particles coated with wheat-germ conjugated apoHRP,,WGAapoHRP,Retrograde tracing method that combines WGA-HRP with gold particles (10-20 nm). It can be viewed directly through a light microscope and used in EM.,Mihail Bota,,,,,,,retrograde tracing,,,,,,,,,,,
KSC_M:00000135,diOListic labeling,,diOListic,"Neurons labeling method with lipophilic carbocynine dyes that are injected into the cells of interest. These dyes label efficiently the neuron membranes, providing a more accurate view of dendrites and dendritic spines. It can be used in comination with retrograde tracers. ",Mihail Bota,,,,,,,intracellular labeling method,,,,,,,,,,,
KSC_M:00000136,retrograde tracing of diOListic neurons,,,"Combination of retrograde tracing methods with micorparticles or fluoorescent tracers (e.g., fluorogold) with the intracellular filling of neurons with lipophilic carbocyanine dyes.",Mihail Bota,,,,,,,retrograde tracing,,,,,,,,,,,
KSC_M:00000137,anterograde tluorescent tracing,,,"Class of tract tracing methods that use anterogradely transported fluorescent markers. Some of the most commonly used markers are biotinylated dextran amine (BDA), Phaseolus vulgaris leucoagglutinin (PHAL), Lucifer yellow-dextran, fluorescein-dextran, and Fluoro Ruby (tetramethylrhodamine-dextran), neurobiotin, and biocytin. One of the advantages of these markers vs the tritiated amino acids is that the course and terminations of labeled axons can be directly visualized.",Mihail Bota,,,,,,,anterograde tracing,,,,,,,,,,,
KSC_M:00000138,biotinylated dextran amine tracing,,BDA,"Anterograde tracing method using BDA as a marker. The 10kDA BDA is one of the best markers for anterograde tracing in different species, while the 3kDA BDA is used for cell filling, and for retrograde tracing.",Mihail Bota,,,,,,,anterograde tracing,,,,,,,,,,,
KSC_M:00000139,phaeolus vulgaris leucoagglutinin tracing,,PHAL,"Anterograde tracing method using PHAL as a marker, which is considered the ""gold standard"" (at least in small animals). PHA-L labels the axons only anterogradely when iontophoretic injections are employed, and there are very few cases of dendrites labeling when the marker was pressure-injected.",Mihail Bota,,,,,,,anterograde tracing,,,,,,,,,,,
KSC_M:00000140,coinjection tract tracing,,COIN,"Tracing method that involves the injection of two markers in the same injection site. Usually, one anterograde and one retrograde tracer are injected, for simultanerous detection of both inputs and outputs of regions of interest.",Mihail Bota,,,,,,,anterograde and retrograde tract tracing,,,,,,,,,,,
KSC_M:00000141,double coinjection tract tracing,,DCOIN,"Tracing method that involves injections of two pairs of stains, in two different regions. Each coinjection includes one anterograde and one retrograde tracer. This method is used for unraveling and visualization of networks in regions of interest.",Mihail Bota,,,,,,,anterograde and retrograde tract tracing,,,,,,,,,,,
KSC_M:00000142,transsynaptic tracing,,,Class of tracing methods that label connections across more than one node.,Mihail Bota,,,,,,,tract tracing,,,,,,,,,,,
KSC_M:00000143,degeneration transsynaptic tracing,,,Tracing methods based on lesions of tracts that induce degeneration of fibers beyond the first synaptic station (terminal field).,Mihail Bota,,,,,,,degeneration method | anterograde tracing | transsynaptic tracing,,,,,,,,,,,
KSC_M:00000144,viruses transsynaptic tracing,,,"Tracing methods that use viruses (e.g., PrV and Bartha) as markers, and which label connections beyond the first synaptic station. Viruses that allow transneuronal labeling include Herpes simplex (HSV1) and pseudoraies virus (PRV), and the CSV strain of the rabies virus.",Mihail Bota,,,,,,,anterograde and retrograde tract tracing | transsynaptic tracing,,,,,,,,,,,
KSC_M:00000145,double-virus translabeling neuron method,,,"Virus transsynaptic tracing method that uses two different viruses to characterize funcitonally related networks. Each virus is genetically modified in such a way that it expresses a specific antigen. The network infected by each virus is identified immunohistochemically, and the common nodes will be doubled labeled.",Mihail Bota,,,,,,,viruses transsynaptic tracing,,,,,,,,,,,
KSC_M:00000146,double recombinant viral transsynaptic tracing,,,"Virus transsynaptic tracing method that uses two strains of recombinant rabies virus (RV), each of them modified in such that it will express an unique marker in infected neurons. The RV propagates retrogradely, and if injected in two regions, the network infected by each strain will include the associated marker. The identification of each network is performed histochemically, and the common nodes will be double labeled.",Mihail Bota,,,,,,,viruses transsynaptic tracing,,,,,,,,,,,
KSC_M:00000147,golgi-like retrograde labeling using viruses,,,Cytochemical labeling methods that uses retrograde tracing with retrogradely-propagating viruses followed by the antibody-based detection of the infected neuron.,Mihail Bota,,,,,,,intracellular labeling method,,,,,,,,,,,
KSC_M:00000148,golgi-like retrograde labeling using rabies virus,,,"Golgi-like retrograde labeling method that uses the rabies virus to label a neuron, followed by a specific antibody-based detection of the infected neuron. This method has the advantage of not labeling fibers of passage.",Mihail Bota,,,,,,,golgi-like retrograde labeling using viruses,,,,,,,,,,,
KSC_M:00000149,golgi-like retrograde labeling using herpes virus,,,"Golgi-like retrograde labeling method that uses the herpes virus to label a neuron, followed by a specific antibody-based detection of the infected neuron.",Mihail Bota,,,,,,,golgi-like retrograde labeling using viruses,,,,,,,,,,,
KSC_M:00000150,single cell juxtacellular recording-labeling technique,,,"Combination of the intracellular filling method and extracellular electrophysiological method. The pipette is used both for iontophoretic filling of the cell of interest, and as an electrode for monitoring the electrophysiological activity of the neuron. The pipette should be in juxtaposition with the cells' membrane. It can be used for morphological recostruction and electrophysiological monitoring of micromodules made of adjacent neurons.",Mihail Bota,,,,,,,intracellular labeling method,,,,,,,,,,,
KSC_M:00000151,loose-patch-juxtacellular recording,,,Variant of the single cell juxtacellular recording-labeling technique.,Mihail Bota,,,,,,,intracellular labeling method,,,,,,,,,,,
KSC_M:00000152,bioimaging,,,General class of non-invasely techniques used to visualize structures inside the body.,Mihail Bota,,,,,,,visualization method,,,,,,,,,,,
KSC_M:00000154,diffusion magnetic resonance imaging,,dMRI,"MRI methods that uses strong magnetic fields to visualize the diffusion process of molecules, mainly water, in biological tissues, The diffusion of magnetically oriented water molecules is influenced by the presence of objects, which interact with the former. Thus, biological structures are visualized by the contrast with the signal given by the spin relaxation of water molecules.",Mihail Bota,,,,,,,magnetic resonance imaging,,,,,,,,,,,
KSC_M:00000155,diffusion weighted imaging,,diffusion weighted magnetic resonance imaging assay | DWI,"dMRI method that calculates the diffusion rate of water in a location of interest, which is then translated in voxel intensity. Best applied to isotropic volumes, such as the gray matter.",Mihail Bota,,,,,,,diffusion magnetic resonance imaging,,,,,,,,,,,
KSC_M:00000156,diffusion tensor imaging,,diffusion tensor imaging assay | DTI,"dMRI method that is used to visualize anisotropic volumes, such as myelinated fiber tracts. The water molecules align with the tracts, i.e., the diffusion along the fibers is higher than across them. Variants and refinements include the generalized diffusion imaging, and the q-space imaging.",Mihail Bota,,,,,,,diffusion magnetic resonance imaging,,,,,,,,,,,
KSC_M:00000157,metals tracing,,,Tract tracing method based on the transport of metals along axons. Examples include cobalt- nickel- and magnesium-tracing.,Mihail Bota,,,,,,,anterograde and retrograde tract tracing,,,,,,,,,,,
KSC_M:00000158,array tomography,,,"Method used to visualize tens of proteins and peptides in a reconstructed 3D tissue part, together with electron microscopy. A part of interest is fixated in resin, cut in ultrathin slices that are deposited on a single slide, and simultaneously labeled with fluorescently labeled antibodies. The images of all labeled slices are stacked by a fluorescent microscope. After this, the slide can be eluted, and labeled with a different fluorescent antibody.  Finally, after the immunofluorescent analysis, the slices can be imaged by backscatter electron microscopy, and the resulting images are registered with the immunofluorescence images.",Mihail Bota,,,,,,,nucleic acids and proteins measurement,,,,,,,,,,,
KSC_M:00000159,nucleic acids transfection in xenopus oocytes,,,This method is used for functional characterization of proteins in a controlled environment. The expression of genes of interest is realized by their DNA or RNA microinjection into oocytes. This method is widely used for characterization of ion channels.,Mihail Bota,,,,,,,nucleic acids and proteins measurement,,,,,,,,,,,
KSC_M:00000160,single cell multiplex RT-PCR,,,"Multiplex RT-PCR method applied to an individual neuron, which allows identification and semiquantitative measurement of large sets of expressed proteins and peptides mRNAs. It can be combined with whole-cell patch clamp, and with intracellular filling with dyes.",Mihail Bota,,,,,,,multiplex polymerase chain reaction,,,,,,,,,,,
KSC_M:00000161,anatomical part removal,,,A surgery method that separates physically (extracts) an organ or a structural part from the body.,Mihail Bota,,,,,,,surgery,,,,,,,,,,,
KSC_M:00000164,tissue cutting,,,Removal of a part of an organ.,Mihail Bota,,,,,,,anatomical part removal,,,,,,,,,,,
KSC_M:00000167,transversal slicing,,coronoal slicing | frontal slicing | transversal cutting,Removal of a part of the gray matter along the vertical plane of the brain and spinal cord. The result is a set of slices transversal on the longitudinal plane. Also known as frontal or coronal sectioning.,Mihail Bota,,,,,,,tissue slicing,,,,,,,,,,,
KSC_M:00000168,longitudinal slicing,,horizontal cutting | horizontal slicing,Removal of a part of the gray matter along the horizontal plane of the brain and spinal cord. The result is a set of slices transversal on the vertical or coronal plane. Also known as horizontal sectioning or cutting.,Mihail Bota,,,,,,,tissue slicing,,,,,,,,,,,
KSC_M:00000169,sagittal slicing,,,"Removal of a part of the gray matter across the horizontal plane of the brain and spinal cord, lateral to medial.",Mihail Bota,,,,,,,tissue slicing,,,,,,,,,,,
KSC_M:00000170,oblique slicing,,,Removal of a part of the gray matter in a plane oblique to any of the three standard ones.,Mihail Bota,,,,,,,tissue slicing,,,,,,,,,,,
KSC_M:00000171,acute slicing,,acute slice,"Cutting method specific to electrophysiological measurements and experiments where the fresh brain is kept and cut in a ""protective"" solution of artificial cerebrospinal fluid.",Mihail Bota,,,,,,,tissue slicing,,,,,,,,,,,
KSC_M:00000172,slice mounting,,,"Method used for observation, measurement and long term preservation of brain and spinal cord slices where they are put on a support medium (glass slides or film) and covered by a transparent medium (coverslip).",Mihail Bota,,,,,,,gray matter tissue preparation,,,,,,,,,,,
KSC_M:00000176,design based stereology,,design-based stereology,Class of stereological methods that are independent of geometrical features and spatial distributions of objects. Design based stereological methods are created a priori of the measured objects and their properties.,Mihail Bota,,,,,,,stereology,,,,,,,,,,,
KSC_M:00000177,model based stereology,,model-based stereology,"Class of stereological methods based on models partially made on a priori knowledge, and partially based on relationships and rules inferred from previous measurements. These methods are likely to hide biased errors.",Mihail Bota,,,,,,,stereology,,,,,,,,,,,
KSC_M:00000178,oblique sectioning,,,Removal of a part of the gray matter across a lane of the brain and spinal cord that makes a nonzero angle with any of the three standard (stereotaxic) planes of cutting.,Mihail Bota,,,,,,,model based stereology,,,,,,,,,,,
KSC_M:00000179,Abercrombie method,,,Model based stereology method that is used to calculate the average number of cells (points) in a section as the ratio of the product between the number of counted cells and thickness of cells and the sum of the length of cell (in micrometers) and the thickness of a cell.,Mihail Bota,,,,,,,model based stereology,,,,,,,,,,,
KSC_M:00000180,Dellese principle,,,Model based stereology method where the percentage of the volume of the substance is equal with the percentage of area occupied by the substance in plane sections for a homogeneous object.,Mihail Bota,,,,,,,model based stereology,,,,,,,,,,,
KSC_M:00000181,linear analysis,,,"Model based stereology method where a grid of equally-spaced parallel lines is superimposed on the plane section. The fraction of total length of these grid lines which lie above the phase of interest, is then an approximation to the area fraction.",Mihail Bota,,,,,,,model based stereology,,,,,,,,,,,
KSC_M:00000182,Glagolev-Thomson point-counting method,,,Model based stereology method where a grid of equally spaced points is superimposed over the section; the number of points that cover the region of interest is an approximation of its area.,Mihail Bota,,,,,,,model based stereology,,,,,,,,,,,
KSC_M:00000183,gray level index method,,GLI,"Design based stereology method proposed by Ziller to approximate the boundaries of a region, based on the gray level index coefficient. It can be addapted to other kinds of tissue classical staining methods.",Mihail Bota,,,,,,,design based stereology,,,,,,,,,,,
KSC_M:00000184,Cavallieri principle,,,Method of volumes approximation. The volume of any object (brain region of interest) can be estimated without bias from the profile areas of the cut sections of the BROI. The cuts through the BROI have to systematically-random sampled. The volume is approximated as the product of the BROI's sum of the profile areas on all sections with the distance between the sections.,Mihail Bota,,,,,,,design based stereology,,,,,,,,,,,
KSC_M:00000185,unbiased virtual counting spaces,,,"Design-based stereological method used to count neurons in a given volume of tissue using the unbiased virtual counting spaces (optical disector, counting box), consisting of the virtual space within the section thickness and an unbiased counting frame.",Mihail Bota,,,,,,,design based stereology,,,,,,,,,,,
KSC_M:00000186,physical disector method,,,"Design-based stereological method used to count neurons in a given volume of tissue using a disector, and based on the analysis of two focal planes within a thick section (the thickness is taken into account, hence the section is 3D), or of two thin (the thickness of sections is negligible, hence the section is 2D] adjacent sections.",Mihail Bota,,,,,,,design based stereology,,,,,,,,,,,
KSC_M:00000187,fractionator method,,,Design-based stereological method used to count neurons in a brain region of interest where the total number of neurons is product of the number of neurons counted within all unbiased virtual counting spaces with the reciprocal value of the sampling probability.,Mihail Bota,,,,,,,design based stereology,,,,,,,,,,,
KSC_M:00000188,nuclear method,,,Design-based stereological method used to estimate mean nuclear volumes of neurons. The midpoint of the nucleolus is selected as sampling unit. The distance from the midpoint of the nucleolus to the nuclear boundary is measured in four mutually orthogonal directions. From the average of the third powers of these measurements an unbiased estimate of the nuclear volume can be obtained. (Gunderson 1988).,Mihail Bota,,,,,,,design based stereology,,,,,,,,,,,
KSC_M:00000189,rotator method,,,Design-based stereological method used to estimate mean nuclear volumes of neurons where the midpoint of the nucleolus is selected as sampling unit.,Mihail Bota,,,,,,,design based stereology,,,,,,,,,,,
KSC_M:00000190,point sampled intercepts method,,,"Design-based stereological method used to estimate mean nuclear volumes of neurons. In this method, all nuclei of neurons that are found in a focal plane are considered. A set of parallel lines is randomly drawn in the focal plane, and the volume a nucleolus is estimated from the lenghts of the intercept of the test line between its nuclear boundaries. [Gunderson, 1988]",Mihail Bota,,,,,,,design based stereology,,,,,,,,,,,
KSC_M:00000191,Fakir probes,,,"Design-based stereological method used for evaluation of surface areas, which is based on counting intersections between the surface and a spatial grid consisting of systematic probes of parallel test lines.",Mihail Bota,,,,,,,design based stereology,,,,,,,,,,,
KSC_M:00000192,isotropic Fakir probes,,,"Design-based stereological method used for evaluation of surface areas of thick sections (the thickness of the section is non-negligible, therefore the section is a 3D object]. A set of orthogonal triplets of perpendicular test lines are systematically and randomly placed within thick sections containing the surface of interest. The intersections between the surface and the test lines are counted, and the surface area is calculated from the total number of intersections.",Mihail Bota,,,,,,,design based stereology,,,,,,,,,,,
KSC_M:00000193,Space Balls method,,,Design-based stereological method used for evaluation of the length of fibers. Spheres of hemispheres are systematically and randomly placed in the brain region of interest. The average density of the linear structure (fiber) is obtained from the total number of intersections between the spheres and the fiber. The length of the fiber is estimated as the product between the length density and the estimated volume of the brain region of interest.,Mihail Bota,,,,,,,design based stereology,,,,,,,,,,,
KSC_M:00000194,isotropic virtual planes,,,"Design-based stereological method used for evaluation of the length of fibers in thick samples (the thickness is non-negligible, hence the object is 3D). The length of the fiber is evaluated using software-randomized isotropic virtual planes in volume probes, in systematically sampled microscope fields.",Mihail Bota,,,,,,,design based stereology,,,,,,,,,,,
KSC_M:00000195,proportionator method,,,"Design-based stereological method used for evaluation of the number of neurons in a given tissue that is similar to the fractionator method, but the sampling procedure is dependent of the neurons sizes.",Mihail Bota,,,,,,,design based stereology,,,,,,,,,,,
KSC_M:00000196,nearest neighbor analysis,,,Design-based stereological method used for evaluation of the cytoarchitecture of a brain region of interest. The method is similar to the nearest-neighbor distance distribution function analysis. This method requires thick sections.,Mihail Bota,,,,,,,design based stereology,,,,,,,,,,,
KSC_M:00000197,Voronoi tesselation,,,"Design-based stereological method used for evaluation of the cytoarchitecture of a brain region of interest. The method first computes the vicinity of a neuron, i.e., a polygon around the neuron, the Voronoi or Dirichlet polygon. This is repeated for each neuron in such way that each of them is included in a polygon, or tile (tesselation), or cell.",Mihail Bota,,,,,,,design based stereology,,,,,,,,,,,
KSC_M:00000198,voltage clamp technique,,VC,"Class of intracellular electrophysiological techniques where the trans-membrane difference of potential (voltage) is kept constant, and the ion currents are measured.",Mihail Bota,,,,,,,intracellular recording,,,,,,,,,,,
KSC_M:00000199,two-electrode voltage clamp technique,,TEVC,"Voltage clamp method that uses two intracellular electrodes instead of one, and is preferred for measuring high currents and for larger cells such as oocytes.",Mihail Bota,,,,,,,voltage clamp technique,,,,,,,,,,,
KSC_M:00000200,dual cell voltage clamp technique,,DCVC,Variation of the two-electrode voltage clamp method specifically designed to study kinetics and conductance of gap junctions.,Mihail Bota,,,,,,,voltage clamp technique,,,,,,,,,,,
KSC_M:00000201,single electrode voltage clamp technique,,SEVC,"Class of voltage clamp methods where a single intracellular electrod is used for both clamping the cell and for measurement. Used for small cells, or cells that are difficult to get to. Also used for study of plants cells.",Mihail Bota,,,,,,,voltage clamp technique,,,,,,,,,,,
KSC_M:00000202,continuous single electrode voltage clamp method,,cSEVC,Single electrode voltage clamp method where both measurement and clamping are performed in the same time.,Mihail Bota,,,,,,,single electrode voltage clamp technique,,,,,,,,,,,
KSC_M:00000203,discontinuous single electrode voltage clamp method,,dSEVC,Single electrode voltage clamp method where the sharp electrode is rapid switched between the measurement mode and the clamping mode. The cell membrane needs to be enzymatically removed.,Mihail Bota,,,,,,,single electrode voltage clamp technique,,,,,,,,,,,
KSC_M:00000204,current clamp technique,,,Intracellular electrophysiological technique where the current is kept fixed by the experimenter and the voltage is measured.,Mihail Bota,,,,,,,intracellular recording,,,,,,,,,,,
KSC_M:00000205,amperometry,,,"Extracellular method used for detection of ions in an aqueous solution, based on electric current or changes in electric current. Also known as pulsed amperometric detection.",Mihail Bota,,,,,,,extracellular recording,,,,,,,,,,,
KSC_M:00000206,single potential amperometry,,,Amperometry method where a direct current is applied into the solution. It is used to detect small currents provided by weak ions. Also known as chronoamperometry.,Mihail Bota,,,,,,,amperometry,,,,,,,,,,,
KSC_M:00000207,pulsed amperometry,,PAD,"Amperometry method where a working voltage is applied for a short period of time, followed by different potentials designed to clean the electrodes.",Mihail Bota,,,,,,,amperometry,,,,,,,,,,,
